名称,价格1,价格2,星级,评论数量,排名1,排名2,评论
华为U8860(honor荣耀)高清高速云服务手机（黑，非定制机）,"￥1,037.41","￥1,037.41",平均 4.1 星,341 条商品评论,"3,775",1192,下面我就来公平公正的对比评论下此款手机的优劣：优点：1.外形酷似爱疯。2、价格实惠，半台爱疯的价格。3、待机时间长，两倍爱疯的待机时间，一般三天左右，省电模式可更长，根据使用情况而定。4、系统优化流畅，从未感觉过卡机，512内存已足够应付几乎所有游戏。5、技术更强劲，五秒开机，关机闹钟，想智能机之不敢想。6、相机像素较好，加上华为自身技术过硬，相片可以和卡片机媲美。7、屏幕色彩逼真，几乎察觉不出像素点。8、华为自带的云服务很好用也很实用。优点还有很多，一时间想不起来了。缺点：1、塑胶感重，加上超薄，总担心不经摔。2、触摸屏不灵敏，较于用过较好的智能机的人来说使用感受是有些差，没有使用过电容屏的人来说还是觉察不出来的。3、屏幕触控感应像素点太明显，部分时候影响美观。4、电池容易发热，担不是发烧，对比其他较高参数的智能机或爱疯，这个温度算正常，毕竟主频也那么高了。5、电源键设计有些脑残，靠左边，可能RD是左撇子，毕竟用左手摁电源键的还是少数。6、手机信号差，在室内经常无信号，电话时经常无故断线。部分人说是2G移动卡的原因，3G无此问题，未验证。7、wifi密码问题，不能连接密码小于8位的wifi。8.升級安卓4.0內存太太太小了，基本没戏，准备考虑升级安卓4.0的还是别考虑了。9.屏幕间隙，太太太大了，翘屏，侧边漏光，现在开始有些受不了了。屏幕超出边框许多，边框和屏幕间隙差不多可以放下一粒米。使用两天自动重启过一次（大型游戏安装失败），手机相机故障一次（不知为何软件冲突）。重启后均恢复，未再次发生重启和故障事件。真实使用感受，忘各位能合理采纳。
华为U8860(honor荣耀)高清高速云服务手机（黑，非定制机）,"￥1,037.41","￥1,037.41",平均 4.1 星,341 条商品评论,"3,775",1192,机器总体而言很不错 但是包装太过简陋 加上暴力装卸 难免会有些……其次 机器上面一张最差的膜也舍不得 太那个啥了吧再者 明明是黑色的手机 怎么是白色的耳机呢？最后 发货速度真叫一个慢啊但总体而言机器不错 给好评
华为U8860(honor荣耀)高清高速云服务手机（黑，非定制机）,"￥1,037.41","￥1,037.41",平均 4.1 星,341 条商品评论,"3,775",1192,今天刚收到，升级4.0，运行完美，除了照相机的800万，没有预期的感觉！整体还不错！
华为U8860(honor荣耀)高清高速云服务手机（黑，非定制机）,"￥1,037.41","￥1,037.41",平均 4.1 星,341 条商品评论,"3,775",1192,用了近两天的荣耀了，基本没发现什么不足，优点是外观大气，速度快，4.0的大屏显示效果很好，我觉得对于这个价位，荣耀已经发挥很好了。一开始放上sim卡启动时间有近一分钟，还跟老婆说厂商号称的5秒开机是吹牛，但又特意试了一下，真的有5秒左右，这一点确实是个卖点。我用的移动信号，wap，wlan，家里的wifi都试过了，木有问题。缺点是黑手机竟然配了个白耳机，难看，而且耳机插头跟插孔结合不好，在外边露了一截铜，工艺还有待加强。女儿玩了好长时间水果忍者，背面有点热，但不像有些人说的那么热，要不是有人说热，我还不会注意到这点呢，那点热是完全可以忽略的，我之前只用过一款智能手机，所以太多的我也没发言权。总之，化为的这款机器是值得推荐的，特别是价格只有1899.另外，我游说老婆也买一款白色的荣耀，但她还是决定要等苹果5，看来苹果之外的厂商除了产品外，还有很大的差距呀。
华为U8860(honor荣耀)高清高速云服务手机（黑，非定制机）,"￥1,037.41","￥1,037.41",平均 4.1 星,341 条商品评论,"3,775",1192,真是垃圾中的垃圾，我八月中旬买的这款华为U8860，现在才刚十月初，手机就坏的完全不能用了，拿去售后检修，说是手机浸液了主板坏了，说没有修的必要的，本人人格保证，在我使用的这一个来月的时间内，绝对是在正常的使用操作范围内，从来没有遇到过水或者其他液体，而且手机正面有贴膜，背面又套了完整的防护套，怎么可能就出问题了，而且还跟我说是浸液了，我完全不能接受，华为的售后和卓越的售后均不负责维修，我想知道，我花了近两千块钱难道就买了个只能放在家里供奉的手机吗？连正常使用都不行？买了个一次性产品还没人负责售后维修，我想问下，我们消费者的合法权益在哪里？谁来保障？本来就是冲这卓越上产品的质量好售后好才不惜花更高的价格来这里面东西的，谁知道尽是这样的结局，售后只是一味的说明是由于浸液导致的手机损坏，就把责任推的一干二净，但是作为消费者，我可以担保，本人一直都是合理的操作使用该手机，从来不曾与水接触过，如果这样都要承担这样的后果，那请问，是不是以后买个手机，遇到点冷空气，或者手上出点汗，手机坏了，说是浸液了，也得消费者负责啊？？？？？？？？？？？？？？？？？？？？？？？？？？亏我还一次性在这里买了两个同样的手机，悲剧悲剧悲剧啊....
华为U8860(honor荣耀)高清高速云服务手机（黑，非定制机）,"￥1,037.41","￥1,037.41",平均 4.1 星,341 条商品评论,"3,775",1192,我是2012年3月2号买的货，发生了一些评论，评论一下吧，这是我在卓越网买了几年的东西后，第一次评论。1.手机操控很不错，可能是因为我以前用的手机很烂吧，我用这个手机，感觉它的运转速度等都很好。2.手机性能有一点要说一下，它可能是2点触控的，这在玩杀水果时，经常按了后，没有反应，影响其流畅性。3.这手机可用的内存只有350M左右，且一般会有一半左右，被系统自带或其它无法看到的地方用掉，也就是说，用于软件操控的，最多只有一半而已。其实这不影响实际操作啦，因为我没玩较大的游戏（下载的所有游戏玩都没有问题）。以上是用了10天后的感受吧，接下来说个不喜欢的，原因是，我在卓越网，第一次买了有问题的机器。1.此手机用到第9天时，我正在看手机电视，忽然扬声器用不了了，悲，这是我用了这么多年手机，第一次见到，扬声器坏了。2.因为在15天内嘛，因此就找保修，这时发现了第二个悲哀的事情，发票上的“串码”有涂改的痕迹，无法保修（这点要提醒下在卓越买手机的朋友，要注意发票上的串码是否有修改痕迹，有的话，要尽快找卓越，重发一张，否则可无法保修、包换等的哟）。3.因为这个手机的事，我打了好多次卓越及华为的服务电话，目前还在等卓越寄发票过来，我好跑去维修点开证明，换一部新机器啦，具体情况后面再说。4.卓越网的客服很好，呵呵，服务很不错，这也让我受伤的心好了许多，华为的客服嘛，也不错，比卓越的差了些，差在哪呢，差在声音差了点感情，不过还不错啦，这也是我仍给了3星的评论的原因啦。
华为U8860(honor荣耀)高清高速云服务手机（黑，非定制机）,"￥1,037.41","￥1,037.41",平均 4.1 星,341 条商品评论,"3,775",1192,U8860的质量实在不敢恭维。清明节放假头一天买的，结果节后又过了一天才送到家，这速度太慢了。收到邮包，打开包装，手机倒是全新，但装上SIM卡试用电话，话筒却没有声音。只听到对方的喊话声。太无语了，这新机啊。联系售后，叫在当地的华为服务中心验机，出验机单才给换货。结果又拖了一天，在当地找到华为服务中心。出具了质量缺陷报告。后一工作人员说在这儿也可换新机。结果他们这儿的新机，似乎跟正式销售渠道的新机更有缺陷，来回了2-3趟，才最终搞定，但仍不理想。值得表扬的是当地的华为服务中心人员，服务质量确实不错。本来网上购机是为了减少麻烦，省事省心。结果是更麻烦，更多操了心。华为的质量。。。提升的空间还非常大、非常大。
华为U8860(honor荣耀)高清高速云服务手机（黑，非定制机）,"￥1,037.41","￥1,037.41",平均 4.1 星,341 条商品评论,"3,775",1192,"这款手机本身的速度是很好的，毕竟1.4gHZ,基本上能够满足一些小型的游戏。但是内存真的很小，好像就300多兆，我想这种内存可能对很多游戏会有限制，特别是智能机本身的软件很多很占用内存。另外这款手机的wifi可能也有些问题，我买了之后用了几次wifi都不能连接上网，不论是换家里，公司还是别人中域电讯或者苏宁店里面都不能连接上网（也换过不同的安卓高手试过，均未能行），因此用到周末利马去服务中心测试，希望能赶紧修好。更有意思的是东莞很多华为服务点，而我找到的那家服务点居然服务很多品牌的手机（诺基亚好像只服务他本身的品牌），并且那家店还没有wifi（我真的不知道那个工程师是怎么去操作得出我的手机问题在哪里的结果），把手机交给他们后，说是要等一个小时，出门走了几十米居然碰到另外一家华为的服务中心，好奇的走进去，问了一些跟旁边我保修手机的那家店之间的关系，居然说那家是二级中心，这家店是一级服务中心。郁闷啊，华为的客户服务让我很不解。"
华为U8860(honor荣耀)高清高速云服务手机（黑，非定制机）,"￥1,037.41","￥1,037.41",平均 4.1 星,341 条商品评论,"3,775",1192,第N次在亚马逊购物，第一次评论。首先还是赞扬一下亚马逊的服务，机器是正品全新的，第一天晚上下单，第二天早上到，给力。  关于机器本身，其确实不错。硬件一般般，但是我相信华为是在这款机器上付出了心血的。电池很给力，1930mah电池大，比起其他宣称1930mah的机器名副其实。然后功耗控制得也很不错，玩了整整大半天没用到三分之一的电量。然后发热也控制得不错，玩游戏上网都不会发热。这两点是我最满意的，也是我放弃小米选择荣耀的原因。一句话，选对了。打电话也很清晰，没有之前网上说的那么多问题，除了以上，机器做工也很扎实，不像那些花瓶机，靠谱。  再说下缺点。第一是屏幕比例不是很好，过于“高高瘦瘦了”，看着有些别扭，要是稍微“矮矮胖胖”一点会更好，不过华为的机器好像大部分都是这个样。觉得华为应该提供更多选择，多出一些不同显示比例的机器。第二是运行内存512MB显得有些力不从心。原本以为512完全够用了，只是不曾想到后台程序很耗内存，而且是默认启动的，没法儿自己控制，用手机管家之类的工具关掉又会重启，正常情况下60%-70%的内存消耗率，未免有些大头了。  个人觉得，荣耀最大的特点在于均衡的性能，不会一味追求“大胸肥臀”硬件指标，适合购买 。
华为U8860(honor荣耀)高清高速云服务手机（黑，非定制机）,"￥1,037.41","￥1,037.41",平均 4.1 星,341 条商品评论,"3,775",1192,使用三天感受。先赞亚马逊速度，送货确实快，早上八点下单子，下午六点就送到了。我以前的手机是ZTE V880，优点很多，缺点致命---内存小导致的反应速度奇慢、通话不稳定。下决心换手机，还是挺国产的。一直在小米和荣耀间苦苦选择，考虑到对游戏性要求不高，加上把玩过小米也没有传说中神奇，所以还是冒险赌了荣耀，现在看来这个抉择是正确的。首先看机器做工精良，样子大方。拿到手里大小合适（鄙人手大），轻薄方便。不存在后盖难以开合和按键缝隙的问题（用惯V880，那个后盖很苦逼，习惯了），做工够得上大厂标准。总之机器外形质感超过了预期。再说软件体验，说五秒开机有点虚假宣传，我人工重启了三回，没有一回是十秒以内能开机的。但是进入系统后，速度流畅，反应敏捷，和IP4 的体验有相似之处。和其他国产单核智能机比速度如飞。屏幕颜色鲜艳，只是对比度略微有些高，颜色偏暖，不知道如何调整对比度。是2月份的机器，两点触控，最大的不便是切水果效率没人家五点的高。但是触屏反应灵敏，一般应用足够。原生2.3.6系统未刷机，界面清新，自带软件够我用，我又下了几个小游戏，运行无障碍，体验非常棒。等玩腻了原生系统，就刷到4.0玩玩。照相，马马虎虎过得去，照一般的东西足够了。照室内的东西还是不错的。音乐，我觉得中不溜，比一般国产手机强，但是比起NOKIA 5800 音乐效果还是略差，不如5800还原效果好。白色耳机我倒觉得没什么。通话质量，我觉得不错。外放声音大了有破音，听筒和话筒质量可以，通话质量超过一般智能机水平。最大的缺点，最坑爹的缺点：那个录音机我擦，难道是手机设计时候的BUG吗？我录音出来好像是在几米之外说的话一样，声音和蚊子似的。这是重大缺陷啊，需要改进。不知道华为能不能在新的系统固件包里升级这个东西。
华为U8860(honor荣耀)高清高速云服务手机（黑，非定制机）,"￥1,037.41","￥1,037.41",平均 4.1 星,341 条商品评论,"3,775",1192,"1、物流很快，赞一个；2、开机速度很快，5秒差不多；3、待机2天时间，没有想象中的强大。（这两天正好开会，没什么电话、信息、上网/没挂Q）；4、拍照效果白天还不错，晚上及室内拍照只能说OK；5、操控性不错；6、本身没带贴膜。用后一个月的反应：  1、手机后盖开启积极困难；  2、一个月不到，莫名其妙的自动关机，以为是没电了，充电毫无反应，华为的客服电话是白天9点到18点，无法咨询；  3、卓越亚马逊客服对技术问题一无所知，也无法提供技术帮助。  4、卓越亚马逊的客服的态度实在是不敢恭维,极其恶劣！"
华为U8860(honor荣耀)高清高速云服务手机（黑，非定制机）,"￥1,037.41","￥1,037.41",平均 4.1 星,341 条商品评论,"3,775",1192,我和女朋友的手机一模一样，不过她比我先一个星期买的，她的玩水果忍者可以多个手指操作，而我的最多只能两个手指。还有，她的电池比我耐用很多，她一般能用3~4天，而我就每天都要充电，我也不是经常玩游戏啊。这商家给我的是什么？
华为U8860(honor荣耀)高清高速云服务手机（黑，非定制机）,"￥1,037.41","￥1,037.41",平均 4.1 星,341 条商品评论,"3,775",1192,刚刚收到货，简单操作了一下，很好，很流畅。可能因为首次使用智能机，感觉不错。期待以后更好，希望不要让我失望，支持国货。不足的是没有买白色，因为白色明天才能送到，就退而求其次选了黑色，黑色还便宜不少，黑色也挺漂亮，中规中距，我不喜欢弧形边缘的。总体来说很值得。顺便说个跟商品无关的建议，我下完订单发现有一项选错了，要打电话给客服改一下，在卓越网站上找个半个多小时也找不到客服电话，最后还是百度到的。我觉得客服电话应该在一个明显的位置方便我们找到，例如放在导航栏上方一直显示。
华为U8860(honor荣耀)高清高速云服务手机（黑，非定制机）,"￥1,037.41","￥1,037.41",平均 4.1 星,341 条商品评论,"3,775",1192,"手机质量做工不错,外观很大气.不得不赞一下快递,太快了,我前一天晚上9点左右下单,第二天中午12点就收到了.本来看到发货快递是深圳银捷还有一点小担心,因为在网上一查全部是负面信息,以为要好几天才能到呢,没想到会这么快."
华为U8860(honor荣耀)高清高速云服务手机（黑，非定制机）,"￥1,037.41","￥1,037.41",平均 4.1 星,341 条商品评论,"3,775",1192,"入手一周,总体来说还不错,发热严重,信号不好,3G的号,信号经常不是满格,以前诺基亚的手机经常是满格,WIFI信号也不是很好"
华为U8860(honor荣耀)高清高速云服务手机（黑，非定制机）,"￥1,037.41","￥1,037.41",平均 4.1 星,341 条商品评论,"3,775",1192,送货很快，我常州的，早上订的，下午四点半左右就收到了，包装内有空气包，想的很周到，机器用短信查询过是行货，拿在手里有分量，有感觉，后盖防滑的，（我朋友优雅白的是光滑的）不用戴套了。不过很奇怪，听说现在都升级5点触摸了，为什么我的2月份生产的机子还是2点触摸，朋友的白的却有5点触摸，有人说2点5点无所谓，但是在玩水果忍者变态版时就充分体现出来了，5点那个速度快，分数高的啊。。。。。。果断卸载，伤不起啊。其他还好，上网看图片玩游戏什么的基本只会用到2点，电池还可以，1930毫安的，不过绝对没有评论里的两三天，我有时收收菜玩玩扑克什么的，最多8个小时就撑不住了，但相比同事的三星5830、HTC的G12、素爱LT18i长些（我们四人都在同一房间玩QQ德州扑克，就是梭哈，他们三个都换电池后我基本还有30%），估计光打电话发信息一天24小时应该能顶住，所以再买块电池备用是必须的；还有内置程序实在多，而且系统（2.3.6）自带的QQ在自己根本没有登录的情况下一直自己在后台运行（360卫士能看到强制关闭后一转眼又有了），搞不懂。。。。。。被我ROOT后强制卸载了很多没用的，现在360卫士显示已用内存在165M左右，占47%，感觉速度快了很多，QQ重新装了个2012的，再也没有自己运行了。
华为U8860(honor荣耀)高清高速云服务手机（黑，非定制机）,"￥1,037.41","￥1,037.41",平均 4.1 星,341 条商品评论,"3,775",1192,这款手机华为称为“荣耀”，但是质量实在配不上“荣耀”两字。收到货的时候看到封条良好，当时也不方便，也就没有要求拆开验货。我以为只要质监认真，至少手机的外观上不应该有问题。华为让我改变了这个看法：后台闪光灯处的塑料有“疤痕”；边框和手机屏幕的玻璃有大概1CM没有很好的贴合在一起，由于是黑色的手机，隔远一点看倒看不出来，但是如果用手机看网页，这个问题就有点“刺眼”了；手机屏幕有一排排的小点，均匀分布在整个液晶屏幕上，在网上查了下，很多荣耀都有这个问题，我也中招，虽然大多数时候不会造成干扰，但是也令人不爽；上网的时候手机底部会明显发热。是降价的时候买的，如果花2000多买这个手机，那就真的不值得了……
华为U8860(honor荣耀)高清高速云服务手机（黑，非定制机）,"￥1,037.41","￥1,037.41",平均 4.1 星,341 条商品评论,"3,775",1192,4月7号1899定的，西安8号收到货。以前用过摩托525，和它比较一下，触屏没525反应灵敏，所以刚开始用感觉可不爽：照相800万的和525的500万比，525在手机上照片比华为清晰，电脑上看没华为清晰；玩游戏还没遇到不能玩的，主要下载了跑跑卡丁车，极品飞车，神庙逃亡，没有出现卡顿的现象，而525完全胜任不了这几个游戏；电池比较耐用吧，看一部90分钟的电影，只用了百分之十的电量，这手机看电影还挺好的，比我之前买的p5看着还好；手机信号感觉不怎么好，可能我地处偏僻吧；通话质量，不知道为什么有时打电话有回音。之前没手机一直纠结，刚开在等小米开放购买，等了两次没买到，气的不行然后刚好华为降价了就买了它了，小米感觉太会玩人了，等的过程痛苦啊，还不如买华为荣耀呢。
华为U8860(honor荣耀)高清高速云服务手机（黑，非定制机）,"￥1,037.41","￥1,037.41",平均 4.1 星,341 条商品评论,"3,775",1192,使用几天，相当不错。电池超级给力，一般使用（打电话、上网、QQ）24h开机用了3天。手写屏差了一些。就是亚马逊包装欠佳。
华为U8860(honor荣耀)高清高速云服务手机（黑，非定制机）,"￥1,037.41","￥1,037.41",平均 4.1 星,341 条商品评论,"3,775",1192,做工很好，内置软件不是很多，但还蛮实用的，系统是姜饼的，可以在线升级为冰淇淋三明治，这个设计在安卓机子中也是不多见的。操作界面蛮清新的，显示效果也不错。缺点是，后盖太难打开了，不敢用力，后来上网看了下别人的经验才打开的。
华为U8860(honor荣耀)高清高速云服务手机（黑，非定制机）,"￥1,037.41","￥1,037.41",平均 4.1 星,341 条商品评论,"3,775",1192,"东西还不错，就是本来答应送8G卡,但是没跟手机一起发过来了,害我又等了几天.."
华为U8860(honor荣耀)高清高速云服务手机（黑，非定制机）,"￥1,037.41","￥1,037.41",平均 4.1 星,341 条商品评论,"3,775",1192,使用起来还是挺顺手的。哪都不错，开机也挺快，只是照相机的800万像素并没有预期的好。
华为U8860(honor荣耀)高清高速云服务手机（黑，非定制机）,"￥1,037.41","￥1,037.41",平均 4.1 星,341 条商品评论,"3,775",1192,昨天收到货'当场验啦一下'嗯'很好'用啦差不多一天啦吧'总体来说都很好'很赞
华为U8860(honor荣耀)高清高速云服务手机（黑，非定制机）,"￥1,037.41","￥1,037.41",平均 4.1 星,341 条商品评论,"3,775",1192,话说，卓越的送货速度神奇了的，我大晚上九点下单，第二天下午就到我手上了的！！！真心快啊，大赞啊~还有说道产品的话，第一次用安卓手机，爽爆了，就是手写输入法时，不用劲滑，字体会断，这是唯一的缺点~因为怕从别的地方买不到正品，所以就来这儿了，正品是正品，有点儿小贵了~还有货到付款可不可以不现金交易刷卡的？求解答~
华为U8860(honor荣耀)高清高速云服务手机（黑，非定制机）,"￥1,037.41","￥1,037.41",平均 4.1 星,341 条商品评论,"3,775",1192,"你们的u8860重力感应关了之后,看图片没事,可是用浏览器和听歌,怎么还是自动横屏?电池容易发烫,信号不怎么样,我家里的无线网络,在跟路由器一个屋里,信号就满格,到了客厅,完了,就一个小小的信号格,我的笔记本天天在客厅里上网也没这样.在就是重力感应可能有点问题,关了重力感应,为什么浏览网页还是自动横屏?"
华为U8860(honor荣耀)高清高速云服务手机（黑，非定制机）,"￥1,037.41","￥1,037.41",平均 4.1 星,341 条商品评论,"3,775",1192,手机非常好，对比小米很多时间了，最后还是选择了华为荣耀，外观漂亮，很流畅。
华为U8860(honor荣耀)高清高速云服务手机（黑，非定制机）,"￥1,037.41","￥1,037.41",平均 4.1 星,341 条商品评论,"3,775",1192,蓝牙用不了，怎么回事？？搜索别人的蓝牙搜得到，别人的搜不到这部机的，怎么会这样，还有手机在通话有点爆音，要讲十几分钟后才不会。。。给女友买的，本来要白色，白色没货了，只好下黑色，如果不是促销，2400买这部机绝对不值得。但是谁能告诉我为什么会爆音还有蓝牙的问题
华为U8860(honor荣耀)高清高速云服务手机（黑，非定制机）,"￥1,037.41","￥1,037.41",平均 4.1 星,341 条商品评论,"3,775",1192,刚开始用，体会不深，总体感觉还好。两个问题：一是亚马逊（以及其它网站）上宣传的是有4G内存，但用文件管理器看只有2G可用空间。二是我所欣赏的定时自动开机和自动关机功能，在这个手机上没有。网上看到说有app可做到，但都不是很理想方便。
华为U8860(honor荣耀)高清高速云服务手机（黑，非定制机）,"￥1,037.41","￥1,037.41",平均 4.1 星,341 条商品评论,"3,775",1192,1.速度快，玩各种游戏无压力；2.屏幕大，看电影清晰流畅；3.摄像头比网上评价的要好，尤其是背面的，正面的摄像头效果较差；4.3G上网快，wifi试了一次比较慢，不知道是信号的问题还是手机的问题，需要多测试。
